{
    "name": "akamai_waf",
    "type": "python",
    "clazz": "app.akamai_waf",
    "label": "Akamai WAF",
    "native": false,
    "testUrl": "",
    "category": "Data Enrichment and Threat Intelligence",
    "functions": [],
    "isLicensed": true,
    "pathToLogo": "",
    "encodedLogo": "",
    "connectionParameters": [],
    "isMultiAuthentication": false,
    "desc": ""
}