{
    "name": "zendesk",
    "type": "python",
    "clazz": "app.zendesk",
    "label": "Zendesk",
    "native": false,
    "testUrl": "",
    "category": "Ticketing",
    "functions": [],
    "isLicensed": true,
    "pathToLogo": "",
    "encodedLogo": "",
    "connectionParameters": [],
    "isMultiAuthentication": false,
    "desc": "Zendesk Support integration for incident and ticket management workflows. Supports creating, updating, searching tickets, managing comments, and user lookup via the Zendesk REST API."
  }
